Sn,CODE,Department ,Degree,Hostel,Year of Graduation,City,Country,Designation,Institution,Work Profile,,
79,CR 146,Electrical,B.Tech,Five,1974,Pune,India,Freelance power plant consultant,Retired,"Been a power plant professional and through a 39 yrs career worked in all the systems of the power plant and fully conversent with all the major equipment and proficient in all areas of mechanical electrical and instrumentation. Have been in plants right from construction, commissioning, project Management and O&M.",,
80,CR 147,Electrical,M.Tech,H-12,2005,Pune,India,Specialist,Tata Elxsi Limited,"Specialist at Tata Elxsi Limited. Automotive embedded firmware for, telematic systems, driver assistance systems, Incar infotainment systems",,
81,CR 148,Electrical,B.Tech,H9,2014,Hyderabad,India,Senior Engineer,Qualcomm,"Been working in Qualcomm for 4 years now, as part of Board Support Package division (a fancy term for firmware, basically).Write low level drivers for mobile chipsets that control buses, clocks, interrupts, etc.",,
82,CR 149,Electrical,PhD,H1,2008,Indore,India,Scientific Officer,"Raja Ramanna Centre for Advanced Technology, Indore","Switch Mode Power Supplies, capacitor-charging power supply, solid state Pulse Power Supplies, high power single phase and three-phase power factor correction, Multi Level Converters and their analog and digital controllers.",,
83,CR 150,Electrical engineering,M.Tech,9,2002,Bangalore,India,Senior Staff Engineer,Qualcomm Inc,Senior Staff Engineer at Qualcomm Inc. Works in VLSI Design.,,
84,CR 151,Electrical Engineering,PhD,H4,2011,Navi Mumbai,India,Professor,Don Bosco Institute of Technology,Professor at Don Bosco Institute of Technology,,
85,CR 152,Electrical Engineering ,Dual,5,2017,Noida Delhi NCR,India ,Senior Principal Product Engineer,Cadence Design Systems India pvt ltd,Senior Principal Product Engineer at Cadence Design Systems India pvt ltd.experience in EDA/low power analysis,,
86,CR 153,Energy Science & Engineering,M.Tech,5,2009,Mumbai,India,Senior Manager,Tata Consulting Engineers Ltd.,"Senior Manager at Tata Consulting Engineers LTD. Engineering Consultant for Oil & Gas, Fertilizer, Petrochemical, Chemical, FMCG & Pharmaceutical Industries.",,
87,CR 154,Chemical,B.Tech,13,2007,New Delhi,India,Process engineer,Royal dutch shell,"Senior Process Engineer at Royal Dutch Shell. Over 11 yrs of multi-disciplinary experience in oil and gas industry with BG Group (Acquired by Royal Dutch Shell, in Feb-2016). I have worked in countries - Kazakhstan, Trinidad & Tobago and India. Major Work Trainings have been in USA & UK. Disciplines I have been primarily involved in are – Field Operations, Operations engineering & support and Process Safety",,
88,CR 155,IT,M.Tech,H12,2007,Bangalore,India,Principal Member Technical Staff,Oracle,"Principal Member Technical Staff at Oracle.11 years of experience in C, Systems Programming, Clustering and cloud. ",,
89,CR 156,Mechanical,M.Tech,4,2004,Pune,India,Deputy General Manager,Tata Motors,Deputy General Manager at Tata Motors. Works in the field of Design and development of hybrid and electric vehicles,,
90,CR 157,Mechanical,M.Tech,H12,2004,Haridwar,India,Manager,Bharat Heavy Electicals limited,"Manager at Bharat Heavy Electicals limited working in Design of steam turbine component.Skilled in Skilled Stress Analysis, Power Plants, Finite Element Analysis, and Steam Turbines.",,
91,CR 158,Mechanical,B.Tech,5,1972,MUMBAI,India,Retired as Executive Director,Retired from Nuclear Power Corporation of India Ltd,"Engineering Consultant for Design and Engineering related issues for Systems, Structures and Components especially of Nuclear Power Plants.Former Executive Director (Engineering, Procurement and projects) of NPCIL (Nuclear Power Corporation of India limited).",,
92,CR 159,Mechanical,B.Tech,H5,1988,Bangalore,India,Sr Engineering Manager - Systems Engineering,GE Transportation ,"Sr Engineering Manager - Systems Engineering at GE Transportation.Has done commendable work in Product Design, Systems Engineering, R&D, Mechanical Design and Product Architecture .",,
93,CR 160,Mechanical,M.Tech,H12,2008,BENGALORE,India,Technical manager,Ingersoll rand Ltd,"Technical manager at Ingersoll rand Ltd, has done work in CFD, Thermal, New product development and Six sigma ",,
94,CR 161,Mechanical,Dual,8,2012,San Francisco,USA,Product Manager,VMware,product manager at VMware,,
95,CR 162,Mechanical,Dual,4,2010,Mountain View,United States,Engineering Manager,Tesla,"Engineering Manager at Tesla.Former Product Development Eng. in Lime Lab.Has done M.Sc in Mech Eng. form Stanford University.Inerested in Mechanical Engineering, Product design, Electronics, Auto-pilot, sensors and engineering management.",,
96,CR 163,Mechanical,M.Tech,H-12,2018,Nashik,India,Director,Harshada Composite Solutions LLP,"Founding director of Harshada Composite Solutions LLP. Former Head at Centre of Excellence at Nashik Engineering Cluster. Worked as Product Manager in Mahindra & Mahindra Ltd. Specialised in New Product Introduction / Development (NPI), Carbon Fibre Composites, Product design & manufacturing with Composites, Market Research & Feasibility Study.",,
97,CR 164,Mechanical,M.Tech,1,1974,Pune ,India,Founder MAITRI,MAITRI,"Founder of MAITRI (Making Academia Innovative & Technically Relevant to Industry) Initiative. Member, Board of Governors of Engineering & Management Institutes.Chief Consultant at Forbes Marshall. 
Specialties: Heat Transfer, Heat Exchanger Design, Thermal Engineering, CFD, Energy Management, Innovation management, Knowledge Management, Technology Management, R&D Management, IPR, Industry-Institute Interaction, Collaborative Research with academia and research centers both engineering and medical",,
98,CR 165,Mechanical,M.Tech,H8,2008,Chennai,India,Product Manager,Forbes Marshall,"Product Manager at Forbes Marshall . Post Graduate in Mechanical Engineering from IIT Bombay with experience in product development, from conceptualization to commercialization.
-> Experience in leading teams and project management 
-> Experience in theoretical design validation, building laboratory test rigs, product testing, costing and value engineering.
-> Hands on experience in coding, virtual simulations, data analysis,DFMEA and mathematical modeling
-> Global work experience with cross-functional teams and customers.
-> Innovating and collaborating with research institutes in exploring new technologies ",,
99,CR 166,Mechanical ,Dual,H3,2009,Delhi,India,Application ENGINEER,MathWorks ,"Helping customers from Commercial, Government and Academics areas in the areas ADAS, Robotics, Data analytics and Model based design with MATLAB. Been Dy. Manager at  Whirlpool Corporation.",,
100,CR 167,Mechanical Engg,Dual,H7,2014,Mumbai,India,Executive Engineer (Production),ONGC Ltd.,"R&D related to oil and gas production, also involved in new technology induction and imparting training to young executives, been the Assistant Manager at Philips",,
101,CR 168,Mechanical Engineering,M.Tech,H5 and H12,2013,Bangalore,India,Engineer- Mechanical Component,GE Power,"Inolvved in mechanical design of gas turbine components and responsible for full product lifecycle of respective components from past 5 years. It includes all phases of component design (conceptual to detailed), manufacturing, analysis (CAE), ensuring form, fit and function and interaction with various stakeholders.",,
102,CR 169,Mechanical engineering,M.Tech,H12,2009,Pune,India,Senior project engineer,Atlas copco India ltd,"Project Engineer CAE in GECIA AtlasCopco,Pune.Has worked in THYSSENKRUPP INDUSTRIES INDIA and VJ CORE SOFT PVT. LTD as a design engineer.Is working in the field of the FE simulation from last 8years and has experience in FE software like MSC Nastran, Altair Optistruct.Has also worked in design and development of new components from idea generation to final commissioning.",,
103,CR 170,Mechanical engineering,Dual,8,2009,Bangalore,India,Senior Key Expert,Siemens Corporate Research,"Translational research for various Siemens businesses specializing in low-light imaging and embedded signal processing with proof of concept prototype development. Innovation, System architecture and integration, system modeling, surrogate modeling, electrical machines, robotics, computational models, inverse problems, regression and linear algebra.",,
104,CR 171,MECHANICAL ENGINEERING,B.Tech,5,1982,Mumbai,India,Joint General Manager - Engineering,Larsen & Toubro Limited,"Have experience in engineering of low voltage switchgear products, automation, special purpose machines, product cost control, quality and others",,
105,CR 172,Mechanical Engineering,B.Tech,5,1997,Mumbai,India,Founder - Director,"MCARTech, Inc.","CoFounder - Vice President of MCARTech Inc.Former Chief Manager - Investments and project management in ArcelorMittal KryViy Rih,Ukraine.Has done work in Industrie 4.0, IIOT, Machinery Diagnostics and Predicting Equipment Failure, Manufacturing in Steel, Forgings, Automobile castings, power generation, business management ",,
106,CR 173,MEMS,B.Tech,H2,2006,Pune,India,Founder-Director,ConnViva Technologies Pvt. Ltd.,"founder-director of ConnViva Technologies Pvt.ltd.Guides the business and R&D activities of ConnViva. Raise funds, execute projects, take care of business development, and strategic direction.",,
107,CR 174,MEMS,Dual,5,2015,Hsinchu City,Taiwan,Package design engineer,TSMC,Currently Package Design Architecture Engineer at Back-end Technology with TSMC, Focusing mainly on developing new test vehicles design with package level electrical simulations and testing automation for future advanced node chip-packaging systems based on InFO (Integrated Fan Out Technology ),
108,CR 175,MEMS,Dual,9,2016,Mumbai,India,Team Lead- Li ion battery development,IIT Bombay,"Team lead- Li-ion Cell Development at IIT Bombay - NCPRE (National Center for Photovoltaic Research and Education).Former Business Analyst in Roland Berger,Mumbai.Former Director of IIT Bombay Alumni Association.Is looking forward to pursue a Ph.D. in USA.",,
109,CR 176,MEMS (Meta),B.Tech,2,2008,Jamshedpur,India,Executive Assistant to VP Iron Making,Tata Steel Ltd. ,Executive Assistant to VP Iron Making at Tata Steel Ltd.Has also worked in operations (Raw Material handling and Sinter Plant).,,
110,CR 177,METALLUIRGCAL ENGG.,M.Tech,3,1981,NAVI MUMBAI,INDIA,MANAGING DIRECTOR,ASTRO METALLURGICAL (I) PVT LTD,Managing Director at ASTRO METALLURGICAL (I) PVT LTD.,,
111,CR 178,Metallurgical Engineering & Materials Science,B.Tech,4,1962,Mumbai,India,INDEPENDENT DIRECTOR,JSW GROUP,"Retired after serving Nonferrous,Iron & Steel,Cement industries. Associated with setting up of Zinc industry,Three Major Steel Plants and 1 Slag based Cement plant in the country. Actively looked after CSR n Sustainability issues. Presently Independent Director in Steel n Cement companies.",,
112,CR 179,Metallurgical Engineering and Materials Science,B.Tech,10,2006,Gurgaon,India,Member of Technical Staff,Global Foundries,"Member of Technical Staff, Computational Lithography at Global Foundries. Part of semiconductor industry. Previous experience of a Characterization Engineer in IBM.",,
113,CR 180,Metallurgy and material science ,Dual,Hostel 10 ,2012,San Francisco ,California ,Summer Associate ,McKinsey and co. ,summer associate at McKinsey and co.,,
114,CR 181,Metallurgy and Materials Science,B.Tech,7,1971,Pune,India,Retired,N.A.,"Over 42 years experience in Steel-making and processing industry including electric furnace steel-making, continuous casting hot and cold rolling of flat and long steel products, covering manufacturing, quality control and assurance, product development and research.",,
115,CR 182,Reliability/Electrical Engg.,M.Tech,Hostel 6,2006,Bengaluru,India,Sr Staff,Qualcomm,Senior Staff Member in Qualcomm.Has done commendable work in Very-large-scale integration(VLSI)-Digital Design Methodologies.,,
116,CR 183,Sensor Systems Integration,M.Tech,H3,2003,Pune,India,Sr. Technology Laad,John Deere India Pvt. Ltd.,"Domain - Embedded Systems, Electronics Hardware design, Matlab, Sensor design and Simulation. Systems Engineering and Systems Integration. DFSS. Provide technical leadership to the Advanced Sensing Portfolio with clear focus on delivering innovative value proposition in terms of products, solutions & methods",,
117,CS 101,Computer Science and Engineering,B.Tech,8,1996,Jaipur,India,Settlement Commissioner,Government of Rajasthan,Settlement Commissioner of Government of Rajasthan.,,
118,CS 102,Civil,B.Tech,7,2015,Bangalore,India,Co-founder,Emerging Talent Pvt Ltd,Co-founder of Emerging Talent Pvt Ltd,,
119,CS 103,civil,M.Tech,12,2009,bangalore,india,Executive Engineer (IES),Central Government ,"Works as Executive Engineer (IES) for Central Government.Major area of work is National Highways related Planning,design project,management and decision making. ",,
120,CS 104,Metallurgy,B.Tech,SIX,1978,Pune,India,Retired Defence Service Officer ( Army),Nil,"Served in the Indian Army for 30 years. Providing Engineering Support to all Army Technical Equipment. Job involved repair, maintenance, recovery, indigenisation,  reverse engineering, inspection and innovative approach to Equipment issues.",,
121,CS 105,Aerospace Engineering,Dual,H13,2012,New Delhi,India,Assistant PF Commissioner,Ministry of Labour (EPFO) ,"Assistant PF Commissioner, at Ministry of Labour (EPFO)",,
122,CS 106,Mechanical,Dual,"6,13",2007,Mumbai,india,Senior Superintendent,"Government of India, Dept of Posts","Senior Superintendent , Dept of Posts,Government of India.",,
123,CS 107,Civil Engineering,M.Tech,H12,2009,Pune,India,Deputy Director,Central Water Commission,"Deputy Director at National Water Academy,Pune.Former Assistant Director in Central Water Commission,New Delhi.Main area of work is Structural Engineering, Design of Hydropower Plants, Analysis of Underground Structures, Training and Capacity Building.",,
124,CS 108,chemical engineering ,B.Tech,3,2003,kota,india,deputy commissioner,Indian Revenu Service ,"Indirect tax administration, civil services, Astt Commissioner at Ministry of Finance in Indian Revenue Service ",,
125,CS 109,Civil,B.Tech,6,2014,Delhi,India,IPS Probationer (On leave),Student (On leave),"IPS Probationer,Worked as an Credit Risk Analyst for 1 year in Citi Bank, Recently cracked Civil Services Exam 2016.",,
126,CS 110,Mechanical ,B.Tech,3,2013,Kolkata,India,Assistant Commissioner ,"Department of Revenue, Min of Finance","Assistant Commissioner at Department of Revenue, Min of Finance.Can provide guidance relating to civil services and other governmental jobs. ",,
127,CS 111,Chemical Engineering,B.Tech,10,2013,Dehradun,India,Indian Forest Service,Govt of India,Working in Indian Forest Service Govt of India.Presently going under training for Indian Forest Service at Dehradun. Have got Himachal Pradesh cadre and will get field posting in next year may.,,
128,CS 112,MEMS,B.Tech,13,2010,PATNA,India,IAS Officer Trainee,Government of India,"IAS officer trainee , General Administration ",,
129,CS 113,Civil,B.Tech,2,1969,MUMBAI,India,Retired,former Central Information Commissioner,former Central Information Commissioner. First generation entrepreneur and then RTI activist,,
130,DO 101,IDC,M.Des,14,2015,New Delhi,India,User researcher,SocialCops (last company),"User researcher at SocialCops.  Part of 'Collect Business Unit'. Collect is a SaaS product for mobile field data collection with offline functionality. 60,000 field auditors used Collect to capture 1.2 billion data points in 2017. Collect is known for its simple and user-friendly mobile app. 
Key responsibilities include: 
1. Embedding user-centered design in the team
2. User research and client feedback
3. Conceptualization and wireframing for new/existing features
",,
131,DO 102,Mechanical engineering,B.Tech,2,1974,MUMBAI,India,Retired as GM(Ops),Mechelonic Engineers Pvt. Ltd.,Retired general manager of Mechelonic Engineers Pvt. Ltd.,,
132,DO 103,Aerospace,Dual,H9,2005,Mumbai,India,Founder and CTO,Coverfox insurance broking pvt. ltd.,Founder and CTO at Coverfox insurance broking pvt. ltd.,,
133,DO 104,Electrical Engineering,Dual,8,2013,Mumbai/Philadelphia,India/United States of America,Associate ,SAIF Partners,Associate at SAIF partners.Used to look at end-to-end venture investments from sourcing to evaluation of companies to working with portfolio companies,,
134,DO 105,Chemical,B.Tech,3,2014,Mumbai/Hyderabad,India,Consultant ,YFS,consultant at YFS.Have knowledge in EPC activities from concept to commissioning ,,
135,DO 106,CSE,B.Tech,3,2009,Bangalore,India,Director (Engineering),Dailyhunt,"Is currently the Director( Engineering) at Dailyhunt, India's largest local language news & eBooks platform. Was co-founder and Director at Rockets Science innovations Pvt Ltd. Also was Co-Founder at Adel Technologies private limited which provides consulting and professional services to its clients for data analytics in big data technology and architecture.",,
136,DO 107,Industrial Design Centre,M.Des Industrial Design,H14,2009,Mumbai,India,Manager User Experience Practice,CitiusTech Healthcare Technology ,"CUA & CXA certified UX professional with 8+ years of global consulting experience in UX strategy and design across multiple domains like healthcare, aviation, telecom, e-commerce, consumer electronics, retail, entertainment, automobiles, banking-finance, and hospitality. Present work include designing applications using design methodologies. Conducting design thinking workshops for stakeholders. Training teams on UX processes and methods to derive user centres and business viable solutions.",,
137,DO 108,IDC,M.Des,2,2006,Chennai,India,Senior Consultant,Verizon,"Senior Consultant at Verizon. Interests-Experience Design, Interaction Design being 10+ years into design research",,
138,DO 109,Metallurgy,B.Tech,H4,1985,Pune,India ,CEO,Vedanta EduLearn Services ,CEO at Vedanta EduLearn Services. Career Transitions Coaching. Executive Coaching for Senior Leaders in midsize organisations to Large MNC. Specific interest and focus on evolution of Senior Professionals to take on new roles by enabling smooth transitions to realize their true potential and value to their organisations. ,,
139,DO 110,EE,ALUMNUS,QIP,2014,Kochi,India,ASSPCOATE PROFESSOR,College of Engineering Munnar,Associate Professor at College of Engineering Munnar.,,
140,DO 111,Mechanical,Dual,H2,2004,Gurgaon,India,Partner,Globevestor,"Co-founder and partner of Globevestor (Seed investments in technology startups), was a former Board Observer in Rubique and Flintobox.com. Worked as a consultant in The Boston Consulting Group.",,
141,DO 112,Aerospace Engineering,Dual,Hostel 10,2009,Bangalore,India,Content Manager,BYJUs,"Content Manager at BYJUs(,M.Ed. in Technology,Innovation and Education at Harvard University School of Graduation,Former Research Associate at E1 Educational initiatives,worked as Account strategist at InMobi.Passionate about  translating effective pedagogical practices into educational products/processes,with an 8+ years of work experience in project management, majorly in the edtech space.",,
142,DO 113,Engineering Physics,B.Tech,7,2003,Mumbai,USA,Founder,Spirichuals,"Founder of Spirituals, TEDx Speaker, Life coach and Resident Monk at ISKCON Chowpatty, Conducts highly motivating courses such as 'Agents of Change'",,
143,DO 114,Electrical,B.Tech,9,2004,Indore,India,Assistant Professor,IIM Indore,"Professor of public policy/ administration at IIM Indore; A doctoral student from IIM Bangalore and has been a faculty at Azim Premji University, Bangalore",,
144,DO 115,Civil ,Dual,H2,2011,Mumbai,India,Project Manager,UpGrad,Working at an ed-tech organisation which creates programs for working professionals. Previously have worked in education sector in startups. I have completed my MBA from IIM Calcutta. Can guide the mentee for MBA/b-schools and options in education/social sector.,,
145,DO 116,Electrical,Dual,10,2006,Mumbai,India,Principal,Omidyar Network,"Experimenting with Entrepreneurship and Education Technology- Strong believer of both!, Have been in Education sector for last 10 years with policy organisation, grant making foundations and investment firm",,
146,DO 117,IDC IIT Bombay,M. Des,Hostel 7,2008,BANGALORE,India,AVP Design,Practo,"A design executive with experience in building and leading design teams; the Head of Design and a part of the leadership team at Practo - India's largest healthcare technology platform; Ex Commonfloor, frog design. Design Leader and Advisor",,
147,DO 118,Civil Engineering,B.Tech,"8, 13",2013,Noida,India,Product Manager,Times Internet,"Experienced entrepreneur, passionate about creating delightful user experiences and solving real world consumer problems. Highly Skilled in B2C mobile products, digital, social, analytics and gamification. Hands on experience in Android development & UI/UX design. Love to work on challenging problems, scaling products to millions of users, building world class teams and deliver impact in users ives.

Specialities:
•        Product Management, UX & Strategy
•        Social & Community Products
•        Growth & Gamification Models
•        Data driven decision making and Leadership",,
148,DO 119,Mechanical Engineergin,B.Tech,3,2008,Mumbai,India,Principal,Blume Ventures,"Venture Capital, startups, investment banking, been the Manager of Carbon Clean Solutions",,
149,DO 120,ChE,B.Tech,THREE,1984,Pune,INDIA,Vice President,"1. HARMAN Connected Services,  2. The Ecological Society","IOT, Control & communication, Sustainability, New business models and paradigms such as 'Comfort as a service' and how to enable these models, Help steer the education and research projects at The Ecological Society, participate in teaching for the Diploma in Natural resource Management, Sustainable development & Nature restoration",,
150,DO 121,Chemical Engineering,B.Tech,2,1992,Mumbai,India,India - Africa ESH and Human Rights Lead,Monsanto,"Provide strategic direction and leadership to Environment, Safety & Health (ESH), Occupational Medicine (OM), Vehicle Safety (VS) and Human Rights (HR) programs at Monsanto India and 8 African countries. Lead diverse and talented team to develop strategies consistent with the Company's vision. Recognized as ESH-HR thought leader in Indian Industry. Strong contributor to Global ESH; Asia-Africa Supply Chain and India Supply Chain Leadership Teams. As member of the Global ESH Leadership Team at Monsanto, partner with Global, Regional and Functional Leads to determine overall direction and implementation strategy for company wide ESH initiatives, policies and programs.Have earlier 14 years consulting experience providing ESH services to large multinational industrial clients in 15 countries.",,
151,DO 122,IDC,DIIT,H4,1977,Bangalore,India,CEO,"Composite Technologies Pvt Ltd.,","Product Design in particular sheetmetal cabinets, enclosures etc.,",,
152,DO 123,Energy systems engineering,In area of natural circulation in multiple channels,QIP building 2,Awarded Ph D in year 2007,PUNE,India,Retired Professor in Thermal engg/ Retired Principal,"Member of Heartfulness institute, ","Retired Professor in Thermal engg/ Retired Principal. Member of Heartfulness institute, ",,
153,DO 124,Reliability Engineering,PhD,H3,2000,Hyderabad,India,CEO,Sujana Foundation ,"Currently an Investor, Advisor and Mentor to early stage startups. Entrepreneurship development and building startup ecosystem is my forte. Cofounded Tesla Consulting Group, provides business accelerator & startup accelerator services.",,
154,DO 125,Mechanical Engineering,PhD,H 1,"1986, 2004",Pune,India,Professor ,Modern Education Society's College of Engineering,"Teaching and guiding UG, PG, PhD Students for Project work and mentoring students  ",,
155,DO 126,MEMS,B.Tech,H2,2014,Mumbai/Ahmedabad,India,"Sales Head, Gujarat",Ofbusiness,"If you ask me for 1 field where I have spent most of my professional life, I'll give you 3. I used to be a 9 pointer in college and always dreamt of starting my own business. Foreign interns and high salaries did sway me for a bit but I found my feet eventually. With an insti professor and batchmate, I started a manufacturing company straight out of IIT, which was incubated in SINE. Then when the growth there stabilized, I started a refurshised furniture startup with some IIT alumni. We won the Ten Minute Million at E-cell and scaled it to a lifestyle business. 

I thought of using my manufacturing and trading (furniture) experience and venturing into finance. This led to me starting West Zone operations for Ofbusiness (Series C 30M$ + 100M$ debt line). 1 year fast forward and my team contributes to about INR 25 Cr per month which is about 20% of company topline. 

Being a guide is quite fun for me. I have also mentored a few startups at IIM Ahmedabad and other incubators. Used to be a mentor in the institute as well and also for Avanti Fellows.

Over past few years, I have gained a broad range of experience in manufacturing, consumer goods, commodities sales and also finance. I have held positions in sales, finance and operations roles. If you are stuck somewhere (career/otherwise) and need a holistic perspective, ping me :)",,
156,DO 127,Civil Engineering,Dual,2,2003,Doha,Qatar,NA,Qatar Computing Research Institute,"MS in public policy from Georgia Institute of Technology. Director in nDimensions.Former Investment Officer - India Investments in Grassroots Business Fund,Washington D.C.Has done commendable work in research commercialisation and startups. ",,
157,DO 128,IDC,MDes,H3,1995,Thane,India,Principal designer ,Mahindra,"Principal designer in Mahindra. Interested in automotive , product and graphic design.",,
158,DO 129,Chemical,B.Tech,7,2009,Mumbai,India,Lecturer,Resonance Eduventures Ltd.,Lecturer in Resonance Eduventures Ltd.,,
