Sn,CODE,Department ,Degree,Hostel,Year of Graduation,City,Country,Designation,Institution,Work Profile,,
159,DO 130,MEMS,Dual,9,2012,Mumbai,India,Head of Product,Testbook.com,"Head of Product in Testbook.com.Has done commendable work on Product Thinking, Product Design, Online Businesses/Start-ups, Technology, Analytics and User behaviour.",,
160,DO 131,Chemical,B.Tech,10,2012,Mumbai,India,Community Head,BabyChakra,Community Head in BabyChakra. Can give basic advice on how to choose the right field after graduation,,
161,DO 132,IDC,M. Des,Hostel 6,2008,Hyderabad,India,"Innovation Consultant,  UX Strategist",ADP Pvt Ltd Hyderabad,"Experience Strategist - Innovation Consultant - Design Thinker at ADP, Chief Designer, mobile UX group-Samsung Design Delhi at Samsung Electronics. Specialties: Interaction Design, User Centric Experiential Design, Mobile Experience Design, Mission critical system Design, Innovation, Strategic Design, Consumer Products, Voice of Customer, Product Interaction Design, Design thinking",,
162,DO 133,Mechanical,Dual,13,2008,Pune,India,Founder,Insane Travelers,"Has worked in different fields in the last 10 years including core research at Albert Ludwigs University - Freiburg Germany, engineering product development at Tata Motors, and entrepreneurship. 2.5 years back,decided to get his hands dirty in the field of his personal interest and founded Insane Travelers.Looks forward to take up more projects in future, which are in line with his personal interests.",,
163,DO 134,EE,B.Tech,9,2002,New Delhi,India,Founder,RedCarpetUp.com,"Founder (YCombinator Summer 2015) of RedCarpetUp.com,Gurgaon.Former Vice President - Engineering at PropTiger.com.Former Director - Engineering at Tradus,Gurgaon.Founder of multiple startups. Long experience in ecommerce, payments, large scale internet systems, blockchain and AI",,
164,DO 135,Humanities and Social Sciences,M.Phil,None,2009,Dallas,United States,Graduate Student,Dallas Theological Seminary,"Graduate Student at Dallas Theological Seminary.Former Senior Consultant, Government Advisory - Performance Improvement (Business Advisory Services) at Ernst & Young,Mumbai.Former Senior Consultant, Government Reforms and Infrastructure Development (GRID) at PricewaterhouseCoopers,Mumbai.Is volunteering with a Refugee ministry and involved in ministering to international students in the campuses.",,
165,DO 136,Chemical,B.Tech,8,1971,Mumbai,India,Retired,NA, Interested in Design and Engineering. A Technical consultant,,
166,DO 137,IDC,M Des,H5,2003,Bangalore,India,Founder & Ux Director,Neointeraction Designs,"CEO & Ux Director of Neointeraction designs,Bengaluru.Founder of Oranjdot(was responsible for design delivery).Former Ux Designer at Verizon Data Services.",,
167,DO 138,"CIVIL ENGG, MANAGEMENT, INFO SYSTEMS",M.Tech,NIL,1991,Thiruvananthapuram,India,Techno-legal consultant,independent,"Independent Legal Services Professional in Thiruvananthapuram.Has great experience in marketing, Entrepreneurship, Leadership, Vision and mission formulation etc.",,
168,DO 139,IDC ,M Des ,H9 and H14,2012,Bangalore,India ,Co Founder / Designer ,The Design Thing ,"UX Design, Design Research, Design Entrepreneurship, Architecture, Industrial Design, Pet Foods & Veterinary healthcare, Karate / Martial Arts, Fitness, Bamboo, Real Estate, BFSI, HealthCare Tech, Remote collaboration in Design / Tech, Design Education. For details please check Linkedin profile.",,
169,FN 101,electrical,B.Tech,h9,2013,delhi,india,quantitative strategist ,quadeye securities,have been developing various quant based strategies across different markets and financial instruments. ,,
170,FN 102,Electrical,B.Tech,5,2006,Mumbai,India,Vice President,Apax Partners,"MBA in Finance from The University of Chicago Booth School of Business and MBA in finance strategy from IIM,Ahmedabad.Vice President of Apax Partners,Mumbai.Former Senior Associate Bain Capital.Former Analyst in Goldman Sachs.Major area of interest is private equity.",,
171,FN 103,Civil,B.Tech,9,2016,Mumbai,India,Head of Analytics,eBay ,"Twelve years of experience in the field of analytics. Managed the projects ranging from Customer acquisition, Portfolio management, Existing customer management, Digital engagement business operations and Collections. 
Experienced professional in end-to-end Marketing, Risk, and Digital analytics solutions, with demonstrated ability to drive performance by leveraging cross functional relationships, balanced team coordination, thought leadership and clear written and oral communication.",,
172,FN 104,Electrical Engineering,Dual,5,2016,Mumbai,India,Senior Analyst (Debt Strats),Deutsche Bank,"Senior Analyst at Deutsche Bank,Mumbai.Former Analyst in Credit Suisse,Mumbai.Former Data Analyst in IIT Bombay Heritage Foundation,New York.Major area of interest is Finance, Banking, Strats and CFA.",,
173,FN 105,Mechanical,M.Tech,H6,2007,Mumbai,India,Vice President,Avendus Finance Private Limited,Involved in evaluating structured financing opportunities and structuring debt transactions to formulate optimal financing solutions for corporate clients in India. Expertise in the field of finance,,
174,FN 106,Mems,B.Tech,2,2014,Bengaluru,India,Product Manager,NiYO,"Product manager at NiYO.worked as a technical analyst in an investment bank, founded a couple of start-ups in materials science and digital manufacturing, consulted as an interim CTO and a product manager for two startups prior to this role, hopping across India and Singapore in the past 4 years. Currently working as a product manager in a fintech startup.",,
175,FN 107,Electrical,Dual,2,2011,Mumbai,India,Vice President,AlphaGrep,"Vice President in WorldQuant LLC(working involves development of quantitative models for the efficient prediction of various financial markets),with an experience in Quantitative Research and Algorithmic Trading and finance & expertise in Data Science, Data Analytics, Quantitative Finance, Robotics.",,
176,FN 108,Engineering Physics,Dual,3,2016,Mumbai,India,Analyst,JP Morgan,"Working as Analyst,fixed Income Index Research at JPMorgan Chase & Co. Former Strategy Analyst at Loylty Rewardz Mngt Pvt. Ltd. Investment Banking Professional engaged in Data Science and Big Data Analytics.",,
177,FN 109,Physics ,MSc.,Nine(9),1976,Nagpur ,India,Visiting Professor ,National Institute Of Bank Management Pune,"Visiting Professor,National Institute Of Bank Management Pune. retired as Dy Managing Director from State Bank of India after putting in 38 years of service.Can mentor students in any area.",,
178,FN 110,Mechanical,B.Tech,6,2015,Kolkata,India,Student,IIM Calcutta,Student at IIM Calcutta. Previously Risk Analyst for hedge fund clients at Gravitas,,
179,FN 111,Mechanical,B.Tech,2,2004,Mumbai,India,Vice President,Barclays,"MS in Manufacturing Systems & Technology from MIT. VP, Risk Management at Barclays Bank PLC.Former Analyst in Barclays Capital, Singapore.",,
180,FN 112,SOM,Master of Management,12,2008,Riyadh,Saudi Arabia,Investment Analyst,Jarir investment,"Investment Analyst in JARIR INVESTMENT,Saudi Arabia.Former Associate Vice President of Merisis Advisors,Mumbai.Former Director of UR Associates,Mumbai.",,
181,FN 113,Chemical Engineering,B.Tech,4,2015,Mumbai,India,Investment Banking Analyst,Alantra,Has been working for 3 years with Alantra (C.W Downer) on cross-border M&A transactions.Major area of interest is finance.,,
182,FN 114,Chemical engg,B.Tech,8,2002,Mumbai,India,CEO ,Fincash.com,"CEO of Fincash.com.Expert in Financial services, BFSI",,
183,FN 115,Aerospace,B.Tech,2,2010,Mumbai,India,Assistant Vice President,InCred,"Assistant vice president at InCred .have 5 years of experience in Management Consulting and Investment Banking in global organisations (Deloitte, Credit Suisse and Goldman Sachs). Currently part of the CEO's Office at InCred, a fintech lending company where I drive Product Strategy",,
184,FN 116,CSE,B.Tech,2,2005,Hong Kong,Hong Kong,Hedge fund portfolio manager,Millennium ,Hedge fund portfolio manager at Millenium. Worked in finance trading global markets with investment banks and hedge fund. Worked with Delta One Swaps at Morgan Stanley.,,
185,FN 117,Mechanical,B.Tech,H9,1989,Navi Mumbai,India,Director,5E Finance Holdings Private Limited,Director and Founder of Company Name5E Financial Services, been the Chief Executive & Whole-time Director of L&T Infrastructure Finance Co Ltd, I would like to guide in Infrastructure Finance in specific and financial services in general. 
186,FN 118,Civil,B.Tech,6,2009,Mumbai,India,AVP,Acko General Insurance,"Founder of Expowealth Technologies Pvt Ltd (Expowealth in an online, no-commission investment planning platform). AVP at Acko General Insurance.Worked as leadership associate in Aditya Birla Group.",,
187,FN 119,Mechanical engineering ,B.Tech,6,1997,Hongkong,Hong Kong,Portfolio manager ,BFAM Partners,Portfolio manager  at BFAM Partners(a hedge fund manager based in Hong Kong).Intrerested in finance.,,
188,FN 120,Mechanical,Dual,9,2013,Singapore,Singapore,Senior Associate,KPMG M&A,"Senior Associate at KPMG M&A,former worked in Rothschild(Investment banking).",,
189,FN 121,Chemical engineering,B.Tech,9,2001,London,United Kingdom,Quantitative Risk Manager,HSBC,Quantitative Risk Manager at HSBC.More than 12 years in the area of building market risk models for Capital Markets in investment banking.,,
190,FN 122,Computer Science and Engineering,B.Tech,H-8,2010,Gurgaon,India,Managing Director,Mathisys Advisors LLP,Managing Director at Mathisys. We are a Quant Hedge Fund which is primarily into Algorithmic trading. We do both High Frequency Trading and Medium Frequency Trading. Worked as a Quant Analyst for QuadEye Securities. ,,
191,FN 123,Electrical Engg,Dual,4,2006,London,UK,Director,Deutsche Bank,Synthetic Equities Trader, Director of Deutsche Bank,
192,FN 124,CSE,B.Tech,H8,2012,Barcelona,Spain,Investment Principal,Consensys Ventures,Structuring investment funds for Venture Capital and assessing blockchain projects, Building capabilities for better network and connectivity infrastructure,
193,FN 125,Civil,Dual,13,2008,Mumbai,India,AVP,BNP Paribas Bank,"Relationship Manager and former Assistant VP at BNP Paribas,Mumbai.Former Senior Analyst (Corporate Sector Ratings) in ICRA.Former Intern - Equity Capital Markets (Capital Markets Origination) at Citibank.",,
194,FN 126,Chemical,B.Tech,H10,2005,Gurgaon,India,Investment Officer,IFC,Investment Officer in IFC.Major area of interest in finance.,,
195,FN 127,Electrical,B.Tech,6,2015,Mumbai,India,Associate,Blackstone,"Private Equity Associate at The Blackstone Group,Mumbai.Former Corporate Finance Analyst in Debt Capital Markets | Deutsche Bank.Main area of interest is private equity investment analysis and debt side investment banking.",,
196,FN 128,Computer Science,M.Tech,12,2011,Chennai,India,Team Manager,Royal Dutch Shell,"North America Power Trading, Daily P&L reporting, Stress reporting, Exposure analysis, VaR reporting, Physical and Financial instruments, Forward, Futures, Power swaps, power options and other power derivatives. Spotfire, Python, Macros.Finance in general and the market risk in specialization. Finance for Oil and Gas Industry.",,
197,FN 129,Sjmsom,M.mgmt,15&12,2016,Mumbai,India,Manager,Icici bank,Manager at ICICI Bank. Market Risk- Derivatives and Fixed income. Worked as Software Engineering Analyst at Accenture.,,
198,FN 130,Civil,B.Tech,4,2014,Mumbai,India,Investment Banking Analyst,Credit Suisse Securities,"Investment Banking Analyst at Credit Suisse Securities(help corporates raise money via debt, IPO, QIP etc.).Former Bussiness analyst in Fractal Analytics.Has done Masters in international management form CEMS and MBA from IIM-Calcutta.",,
199,FN 131,Mechanical,Dual,4,2010,Chennai,India,Senior Associate,Creador,Senior Associate at Creador. 5+ years as Investment Professional in Private Equity / Equity Markets. Worked at Thomas White International and Deloitte.,,
200,FN 132,Electrical Engg,B.Tech,H4,2012,Mumbai,India,Senior Manager,HDFC Bank,"Senior Manager at HDFC Bank,Mumbai.Is a Risk Management professional with avid interest in Applications of AI, ML in Finance, International relations and Philosophy.",,
201,FN 133,MEMS,B.Tech,7,2014,Bangalore,India,Investment Banking Analyst,DCS Advisory India,Investment banking analyst helping in companies raise fund and in their M&A.Currently working at DCS Advisory India,,
202,FN 134,Computer Science,Dual,4,2005,Mountain View,USA,Independent Investor and Advisor,NA,"Independent Investor and Advisor at Buxfer,Inc., former Vice President,Investment Analyst at Altavista Investment Management.Investment analyst with more than a decade's experience investing in global equities (fundamentals based long term investing). Proficient in financial analysis, financial modeling and forecasting, business and strategy analysis and derivatives.",,
203,FN 135,Mechanical,B.Tech,4,2014,Kolkata,India,Pgp student,IIM Calcutta,Fixed Income derivatives trading ( Rates and Bonds). Worked with GPS (Multi Assets Macro Investment fund) in the Markets team of Goldman Sachs.,,
204,FN 136,Electrical,Dual,7,2014,Mumbai,India,Associate,Blackstone,"I am currently an MBA candidate at the Stanford Graduate School of Business, Class of 2020. I previouslyworked with Blackstone's Private Equity team in India. I graduated from the Indian Institute of TechnologyBombay with Bachelor's and Master's degrees in Electrical Engineering in 2014.",,
205,FN 137,SOM,Master of Management,H14,2012,Mumbai,India,AVP,Polestar Capital,"AVP at Polestar Capital. Investment Banking and Corporate Finance Advisory. Experienced Assistant Vice President with a demonstrated history of working in the investment banking industry. Skilled in Corporate Finance. Strong professional with a MBA focused in Finance, Strategy from Indian Institute of Technology, Bombay. Worked at Deutsche Bank, AFII Corporate Advisors and Crisil previously.",,
206,FN 138,Mechanical,Dual,3,2007,Bengaluru,India,Finance & Economics Lead,Shell,"Finance & Economics Lead / Group Planning Advisor  and former Senior Business / Upstream Commercial Analyst at Shell,Bengaluru.Former Senior Consultant - Strategy & Operations in Deloitte,Mumbai.",,
207,FN 139,Mechanical,B.Tech,4,2012,Bangalore,India,Manager,Flipkart,Manager at Flipkart, Involved in Program management,
208,IT 101,CSE,B.Tech,H9,2005,Bangalore,India,VP Engineering,Rupeek,VP Engineering at Rupeek.,,
209,IT 102,EE,5 years Integrated M Tech,H6,1995,Bangalore,India,"co-founder, CPO @ LetsVenture.com",LetsVenture.com,"I have over 20+ years experience in software industry primarily working in MNC product companies in India. Tektronix, Unisys, Capital One, Cadence design system and CDC software (earlier Pivotal CRM) are the companies I worked for. In the last assignment, I was VP Engg at CDC Software where I was managing 100-150 person Engg team for their CRM+ product portfolio. After that I co-founded LetsVenture.com, India's largest online platform for early stage startup funding. Over the last 5 years, we have helped raise funding for over 155 startup raising over 62M USD via LetsVenture. I run the Product and Engg team at LetsVenture.",,
210,IT 103,Mechanical,B.Tech,6,2005,Bengaluru,India,Solutions architect,Affairal,"12+ years of experience in building solutions based on distributed systems like Hadoop, indexing technologies like Solr, messaging technologies like Kafka and automated cloud infrastructure services using Amazon web services.",,
211,IT 104,Energy science ,Dual,4,2014,Mumbai,India,Technology Consultant,NISA Global,"Technology Consultant at NISA Global,Mumbai.Former CTO and Backend Lead at Taskbob,Mumbai.Former Software Developer in Housing.com,Mumbai.",,
212,IT 105,SJMSOM,MBA,15,2016,Mumbai,India,Senior Business Analyst,CitiusTech,Senior Business Analyst at CitiusTech(Healthcare Domain related ).,,
213,IT 106,Metallurgical Engineering,B.Tech,H4,1987,Mumbai,India,Partner & Chief Information Officer,Deloitte ,"Currently a Chief Information Officer/Partner for Deloitte (in charge of South Asia & Mauritius), with expertise in IT Strategy, Business Transformation, IT Risk Management, Information Security, Integration of IT in Mergers and Acquisitions, Shared Services, ERP implementation, Privacy and Confidentiality along with experience of leadership of information systems in varied industries such as Information Technology, Telecom, Consulting and Manufacturing.",,
214,IT 107,Electrical,B.Tech,4,1984,Mumbai,India,Consultant,(own consultancy),"Consultant in his own consultancy company with a wide experience in Instrumentation industry (Computers, networks, communication, electronics, electricals, software) in India and abroad,  at site and in office. Engineering and administrative.",,
215,IT 108,Aero,B.Tech,6,2011,Mumbai,India,Senior Product Manager,Get My Parking ,"Senior Product Manager at Get My Parking with 5+ years of experience in working with multiple innovative, high growth technology startups, building and shipping products in the B2C mobile and web space, several of them which have over 1 million downloads. Passionate about creating products that solve valid user problems while providing a first class user experience. ",,
216,IT 109,EE,Dual,2,2012,Mumbai,India,Senior Product Manager,Pharmeasy,"Entrepreneur and Product Management professional with 5+ years’ experience in designing, developing and managing web and mobile products at startups & fast moving companies. I have been leading execution of products while working with the leadership teams at various organizations. I have successfully co-founded and managed consumer internet startup, raised capital and successfully sold the business through a M&A exit.",,
217,IT 110,CS,M.Tech,8,2007,Bangalore,India,Founder,Jupiter Supply Station,"Founder at Jupiter Supply Station. Engineer for 9 years at Google, Founder, Advisor to another startup",,
218,IT 111,Electrical,M.Tech,H6,2009,Pune,India,Senior Software Engineer,Cisco Systems,Software development for mobile packet core network (Mobility gateway for 3G/4G).currently senior software engineer art Cisco systems,,
219,IT 112,Cse,M.Tech,14,2016,Tokyo,Japan,Analyst,Goldman Sachs,Analyst at Goldman Sachs.expert in python and machine learning,,
220,IT 113,Electrical,M.Tech,12,2015,Bangalore,India,Software Engineer ,Intel,"Software Engineer at Intel Corporation; Software Engineer at Ericsson, BNET R&D India",,
221,IT 114,CS and Engg,M.Tech,Eight,1984,Navi mumbai,India,SVP,Reliance Jio,Over 25 years of extensive IT experience in various technical and managerial roles. Currently having responsibility of a set of technology areas for TechMahindra. Was responsible for center of excellence in the area of Telecom Operations Support Systems. Recently I ran a special initiative in Smart Grids.,,
222,IT 115,Chemical,B.Tech,2,2007,Noida,India,Senior Content Lead,Adobe Systems India,Senior Content Lead at Adobe Systems India . He is a technical communicator and a content marketer by profession, UX advocate.Former worked as a Technical Writer in ST Microelectronics.,
223,IT 116,Electrical ,B.Tech,3,1978,Mumbai,India,Business Mentor,Self employed,"Retired. Former Program Manager - IBM India Pvt. Ltd
Program Management - Software Product Development, Software Services, IT Infrastructure Services
Vice President - Operations IBM Daksh Business Process Services Ltd.",,
224,IT 117,Civil Engineering,Dual,H7,2012,Dubai,United Arab Emirates,AVP Engineering,Wadi.com,"Currently AVP Engineer at Wadi.com.I head operations technology for Wadi.com. It means all the internal products, automations and customer interactions that happen after a sale is made. ",,
225,IT 118,Civil Engineering,B.Tech,Hostel 2,2017,Pune,India,Technical Analyst,Citicorp Services India Pvt. Ltd.,"Business Developer in HolaMed Healthcare Technologies Pvt. Ltd.,Mumbai.Former Content Developer at Toppr.com.Has worked on Frontend Development, DevOps (Build & Deployment), Blockchain related developmentand is P\pursuing CFA L2.",,
226,IT 119,EE,Dual,3,2008,Bangalore,India,Graphics Software Engineer,Intel,"9+ years of experience in device driver development for ARM/X86 based embedded systems, largely on Linux/Android. Worked on Graphics Power Conservation, USB, 2D, JPEG and system power management etc subsystems embedded SoCs. Contributed to Linux community as part of my current and previous roles.",,
227,IT 120,Electrical ,B.Tech,10,2016,Mumbai ,India ,Credit Technology Associate ,Jp Morgan ,Credit Technology Associate at Jp Morgan(working as Software development for investment bank),,
228,IT 121,Mechanical,Dual,3,2012,Mountain View,United States,Software Engineer,Google,"I studied Mech Engg (Dual Degree) at IITB, then did a stint in consulting (ATK), followed by a masters in Computational Linguistics (UW). Have been working as a software engineer since 4 years. Joined Google recently. ",,
229,IT 122,Environmental Engineering,M.Tech,9,1981,Bangalore,India,CEO,Magnificient2 Software Services & Technologies Inc,"Management, Startups, Computer Science. Total number of years is 35 in the US where I worked with NASA, IBM and University of Texas @ Austin. My company has been awarded the award for Excellence in Education by Govt. of India in 2016 and it has been selected by Silicon Valley as 1 among the 30 Entrepreneurs for 2018",,
230,IT 123,EE,B.Tech,6,1991,Bangalore,India,Country Head,Uptycs India,"Presently setting up the India Dev Center for Uptycs Inc; Previously handled Products at Innoviti, a fast-growing company in the exciting payments space that pioneered the use of technology to solve payment acceptance problems in retail space",,
231,IT 124,Comp. Sc.,M.Tech,H2,1982,Mumbai,India,"Retd. [VP(Consulting), L&T Infotech]",NMIMS ,"Retd. Adj. Faculty at NMIMS, Former Vice President and Global Head, Consulting at L&T Infotech, Former GM at Syntel. Interested in IT Consulting and Technology Management",,
232,IT 125,aerospace,M.Tech,4,1997,pune,India,sr software consultant,PTC,"Sr. software consultant at PTC.Has worked on software programming in core JAVA, javascript,ProE and windchill.",,
233,IT 126,CSE,M.Tech,"H4, H12",2007,Ahmedabad,India,Founder,Fluvina Technologies,Founder and CEO of Fluvina Technologies(a software development comapny providing services in Health sector).Aslo working as a technology consultant in Jaimedica Pvt Ltd.Former executive director at Effia technologies,,
234,IT 127,Aerospace,B.Tech,4 and 13,2006,pune,india,CTO,Geektree technologies pvt ltd ,"more than 10 years experience in building architecturally complex enterprise solutions as well as open source products; worked with both product firms like SAP Labs and services firms like Talentica Software, Smartek Consultancy.",,
235,IT 128,Mechanical,B.Tech,H2,1990,Bengaluru,India,Vice president,Cambium networks,Vice president of Cambium networks with a working in Computer software and networking equipment.,,
236,IT 129,Sjmsom,Mba,5,2002,DAK. KANNADA,India,Principal consultant,Infosys,"SCM consulting,13+ years of experience of working in infosys",,
237,IT 130,Industrial Engineering & Operations Research,M.Tech,H7,1994,Chennai,India,Consultant,Tata Consultancy Services Limited,"Consultant in Tata Consultancy Services.Former Systems Engineer in Card Systems Private Limited, Nucleus Group.Has worked on Information Technology,Project and Process Management.Interested in Mathematics, Physics, Economics and the Theory of Constraints.",,
238,IT 131,Civil,M.Tech,6,1995,Gurgaon,India,CTO,Legitquest.com,"Chief Technology Officer at LegitQuest - 1-Click legal research,Delhi.Former Chief Executive Officer in Custvantage Consulting Services,Gurgaon.Former CEO/CPO of UrbanHub Technology Solutions,Gurgaon.Is mainly interested in Startup and SaaS B2B Products.",,
239,IT 132,Chemical Engineering,Dual,H7,1998,Bengaluru,India,Technical Program Manager,Dell,"Around 18 years of experience providing project management, operations management, analysis and strategic development solutions in diverse business settings, been the Program Manager at Motorola India Pvt. Ltd",,
240,IT 133,Metallurgy,B.Tech,H5,1993,Mumbai,India,Vice President - Apps,Mphasis Ltd,Vice President - Apps in Mphasis Ltd.Has 25+ years in IT industry working on Technology applications in Banking and Finance area.,,
241,IT 134,Aerospace Engineering,M.Tech,"H6, H13",2012,SINGAPORE,Singapore,"Assistant Vice-President, Regional Project Manager",DBS Bank Ltd,"My work is predominantly around Software Development Lifecycle (SDLC) as a Project Manager and Business Analyst. I am involved in managing, running and executing strategic initiatives for the Retail Banking group across the 6 regions of the bank within Asia. I cover all aspects of SDLC from user-design to financials to deploying the releases to production for the end customer. ",,
242,IT 135,physics,MSc.,H5,1991,chennai,India,PRACTICE DIRECTOR,hcl,PRACTICE DIRECTOR at HCL-Run the banking practice for HCL,,
243,IT 136,Eneregy Engineering,M.Tech,1,2005,Pune,India,Associate Vice-President,Barclays Technology Center India,"AVP / Technical Delivery Manager at Barclays,Mumbai.Has worked in Software Solutions at GE Energy.Former Business Analysis and Finance and Web - Analytics lead at Tech Mahindra and former member of Sales and Marketing Group,Rolta India Limited.Has experience in leading Team, Strategy and roadmap management, Delivery of automation solution on Big data Hadoop, Machine Learning solutions, and Al solutions delivery.",,
